opportunity_id,sales_rep_id,client_name,stage,amount,close_date,renewal_date,email_conversations
OPP67aaa068-8dcf-4198-b0e5-1f30abfa4f2c,EMPb8abf597,"Ramirez, Miller and Johnson",Discovery,113932.46,2025-01-10T06:29:22.606495,2025-12-02T06:29:22.606495,Email thread with Patrick Stevenson on 2024-01-02
OPPd4efad3e-4b8f-42b4-9ddd-6df0329b6386,EMPb8abf597,Cole-Palmer,Case Evaluation,95082.55,2025-01-31T06:29:22.607492,2025-12-02T06:29:22.607492,Email thread with William Miller on 2024-05-27
OPPc816c4aa-6187-41e8-a99a-723fa4b2f62c,EMPb8abf597,"Dominguez, Bowman and Hall",Demo Conducted,122766.62,2025-04-30T06:29:22.607492,2025-12-02T06:29:22.607492,Email thread with Mr. Aaron Graham on 2024-04-22
OPP662a7671-276d-405c-bc30-634aac606a5d,EMPb8abf597,"Summers, Hardin and Foster",Case Evaluation,133211.69,2025-01-04T06:29:22.608489,2025-12-02T06:29:22.608489,Email thread with Stephanie Saunders on 2024-08-15
OPP783d4a6d-4d4e-4e29-99c5-e64cb8c6773e,EMPb8abf597,"Wood, Barnes and Mcintyre",Case Evaluation,119373.11,2025-04-23T06:29:22.608489,2025-12-02T06:29:22.608489,Email thread with Carolyn Johnson on 2024-06-19
OPP10d9e38d-4f73-4fb1-b0dc-9c84f56962c2,EMPb8abf597,"Perez, Rivera and Bennett",Legal,118046.51,2025-05-28T06:29:22.608489,2025-12-02T06:29:22.608489,Email thread with Brittney Underwood on 2024-07-12
OPP197e85a0-c696-4bab-91b2-332ee0934e38,EMPb8abf597,Hahn Inc,Demo Conducted,78554.62,2025-01-15T06:29:22.609487,2025-12-02T06:29:22.609487,Email thread with William Smith on 2024-07-21
OPPadd7ae79-eb0f-4c21-a977-80d1fcd2f001,EMPb8abf597,Leonard-White,Legal,112077.1,2025-05-11T06:29:22.609487,2025-12-02T06:29:22.609487,Email thread with Eric Schmidt on 2024-03-02
OPPe56b3b1d-e54e-4a17-a868-c76b7a94f483,EMPb8abf597,Guerrero Group,Demo Conducted,102445.36,2025-05-28T06:29:22.609487,2025-12-02T06:29:22.609487,Email thread with Diane Yates on 2024-04-27
OPPd1e0a50e-9602-434b-8845-3d3e6424d7ef,EMPb8abf597,Rivera-Murray,Legal,110733.27,2025-02-26T06:29:22.610484,2025-12-02T06:29:22.610484,Email thread with Matthew Calderon on 2024-03-26
OPPa2334974-746c-4933-aee6-9c71ee166b74,EMPb97da9de,Kelley-Harris,Closed Lost,117086.02,2025-02-26T06:29:22.610484,2025-12-02T06:29:22.610484,Email thread with Jessica Williams on 2024-02-05
OPP4f0fa9db-4b6a-4fea-81cf-7f935e6cc9e4,EMPb97da9de,Smith PLC,ROI,105029.13,2025-02-12T06:29:22.610484,2025-12-02T06:29:22.610484,Email thread with Shaun Parrish on 2024-07-01
OPP23a61526-95e3-4329-94cc-a279a63cca75,EMPb97da9de,Meza PLC,Closed Lost,107223.9,2025-04-14T06:29:22.611482,2025-12-02T06:29:22.611482,Email thread with Brian Fletcher on 2024-08-23
OPP33a70c3d-1da5-4563-a939-e190c6f1c3ad,EMPb97da9de,Michael Group,Demo Conducted,116610.25,2025-04-05T06:29:22.611482,2025-12-02T06:29:22.611482,Email thread with John Heath on 2024-07-13
OPP8a34065b-2b05-4a0e-a353-1771ba254533,EMPb97da9de,Taylor LLC,Closed Lost,109917.71,2025-01-15T06:29:22.611482,2025-12-02T06:29:22.611482,Email thread with Jennifer Anderson on 2024-08-31
OPPbafcd1c4-08fb-4e11-b54e-888981acd529,EMPb97da9de,"Wright, Daniel and Vang",Demo Conducted,67129.03,2025-03-07T06:29:22.611482,2025-12-02T06:29:22.611482,Email thread with Kelsey Nguyen on 2024-09-28
OPPe8a74310-6473-4904-8bee-b82c92659b42,EMPb97da9de,Allen-Steele,Discovery,138170.6,2025-01-04T06:29:22.612480,2025-12-02T06:29:22.612480,Email thread with Jared Waters on 2024-05-21
OPP5a57cde5-f13f-440b-889b-9a03bc3548c5,EMPb97da9de,"Brooks, Smith and Thomas",Legal,84524.49,2025-01-05T06:29:22.612480,2025-12-02T06:29:22.612480,Email thread with Melissa Delgado on 2024-02-23
OPP7d534839-d414-4a20-9da7-2b622fabcae1,EMPb97da9de,"Webb, Martinez and Church",Discovery,91217.91,2025-01-28T06:29:22.613477,2025-12-02T06:29:22.613477,Email thread with Shelby Jackson on 2024-09-11
OPP52d1de24-bf3b-458e-902f-e51359eea30b,EMPb97da9de,Galloway Inc,ROI,50408.66,2025-05-27T06:29:22.613477,2025-12-02T06:29:22.613477,Email thread with Kathleen Chen on 2024-05-04
OPP9e19e188-1da1-4d7a-a281-becd3084486f,EMPb97da9de,"Vaughn, Gomez and Ross",Legal,68356.17,2025-04-08T06:29:22.614473,2025-12-02T06:29:22.614473,Email thread with Donald Mcfarland on 2024-05-30
OPPa3455904-0830-47b4-9b5e-ea1f8eace752,EMPb97da9de,Hall-Johnson,Demo Conducted,112537.38,2025-03-31T06:29:22.614473,2025-12-02T06:29:22.614473,Email thread with Kimberly Osborne on 2024-03-02
OPPbe98e6d2-0bf2-41da-830e-055ceb76dbed,EMPb97da9de,Sharp-Forbes,Demo Conducted,118523.64,2025-04-04T06:29:22.614473,2025-12-02T06:29:22.614473,Email thread with Aimee Gregory on 2024-03-29
OPPee9d0e10-f9d7-479d-bd0b-fd3ba7d8baef,EMPf11dd212,"White, Wood and Sampson",Legal,150000.0,2025-03-08T06:29:22.615471,2025-12-02T06:29:22.615471,Email thread with Ashley Jimenez on 2024-08-08
OPP68736d8a-12ee-4e46-97e2-7d7a9c369f6d,EMPf11dd212,Li-Gregory,Case Evaluation,135771.73,2025-01-31T06:29:22.615471,2025-12-02T06:29:22.615471,Email thread with Alvin Lawson on 2024-05-07
OPP3bf4d4bc-678f-481f-a3cc-4a042c071e27,EMPf11dd212,"Dunn, Gonzalez and Levy",Proposal,80998.36,2025-01-03T06:29:22.615471,2025-12-02T06:29:22.615471,Email thread with Nicole Macdonald on 2024-06-25
OPP731b8cf9-a881-492c-8bf7-2e12e0305e2d,EMPf11dd212,"Montgomery, Cook and Short",Discovery,63510.84,2025-05-07T06:29:22.616469,2025-12-02T06:29:22.616469,Email thread with Raymond Smith on 2024-05-21
OPPe6ab5199-de93-4896-bada-5a662fa0823a,EMPf11dd212,Bowen Ltd,Closed Won,131885.65,2025-01-02T06:29:22.616469,2025-12-02T06:29:22.616469,Email thread with Renee Goodman on 2024-09-02
OPPc3a24c35-6291-4a04-abbd-383ae6e7ac6e,EMPf11dd212,"Smith, Melton and Lopez",Demo Conducted,102339.16,2025-01-17T06:29:22.616469,2025-12-02T06:29:22.616469,Email thread with Jennifer Long on 2024-02-29
OPPffdb8ef3-619b-451e-adca-0f0aadc11d69,EMPf11dd212,Wilcox-Doyle,Closed Lost,73645.05,2025-01-24T06:29:22.617467,2025-12-02T06:29:22.617467,Email thread with Cindy Brown on 2024-03-02
OPP4d01cc36-0091-4b3d-918b-55fde8968a9f,EMPf11dd212,"Lopez, Ferrell and Wright",Case Evaluation,97147.72,2025-01-03T06:29:22.617467,2025-12-02T06:29:22.617467,Email thread with Joseph Newman on 2024-05-04
OPP7d90d1f8-6ca1-47a8-ba71-d93589d9a401,EMPf11dd212,Wilson-Jacobs,Discovery,97504.58,2025-05-07T06:29:22.617467,2025-12-02T06:29:22.617467,Email thread with Nathan Bennett on 2024-07-18
OPPa56a4a75-eff2-491a-bffc-4eea05f7e0d1,EMPf11dd212,"Valentine, Harris and Nelson",Proposal,88674.88,2025-02-24T06:29:22.619460,2025-12-02T06:29:22.619460,Email thread with Jennifer Johnson on 2024-01-09
OPPf3be0a6c-15ec-4910-8e38-34376a1c7817,EMPf11dd212,Marquez-Johnson,Demo Conducted,89506.12,2025-02-18T06:29:22.619460,2025-12-02T06:29:22.619460,Email thread with Robert Vaughan MD on 2024-07-02
OPPbe7cbe1e-8e4e-4077-b1e5-4207861ff6a2,EMPf11dd212,"Warner, Wells and Lopez",Legal,67698.73,2025-05-17T06:29:22.620457,2025-12-02T06:29:22.620457,Email thread with Allison Kelly on 2024-04-29
OPP18eec8cc-381d-4e21-9112-44066e30d1ba,EMPf11dd212,Kramer Group,Legal,66987.47,2025-02-09T06:29:22.620457,2025-12-02T06:29:22.620457,Email thread with Victoria Crawford on 2024-11-24
OPPfb6de7c2-b1df-4a7c-9c30-571770b2b64a,EMPf11dd212,Burns LLC,Proposal,104847.83,2025-02-11T06:29:22.620457,2025-12-02T06:29:22.620457,Email thread with Michael Cummings DVM on 2024-10-28
OPP82bca728-ec20-4495-9c5b-6d490b7ffede,EMPf11dd212,Long-Nichols,Closed Won,85528.9,2025-03-09T06:29:22.621455,2025-12-02T06:29:22.621455,Email thread with Anne Shannon on 2024-07-14
OPPef137c97-1058-4f45-a539-021523c0b469,EMPec58906b,Lee-Johnson,Case Evaluation,80131.47,2025-03-24T06:29:22.621455,2025-12-02T06:29:22.621455,Email thread with Kenneth Williams on 2024-09-01
OPP902a94ca-22a8-4558-9028-ad8677698480,EMPec58906b,Miller-Kelly,ROI,95802.11,2025-02-18T06:29:22.621455,2025-12-02T06:29:22.621455,Email thread with John Wood on 2024-05-08
OPP9fce8337-19c6-43ba-a1bd-8bab1a6e9ef7,EMPec58906b,"Rodriguez, Sandoval and Davies",Closed Won,108415.41,2025-02-08T06:29:22.622452,2025-12-02T06:29:22.622452,Email thread with Randy Sandoval on 2024-07-03
OPP36c55e3b-a203-4291-a793-f6a967ab4d37,EMPec58906b,Butler LLC,Proposal,73294.99,2025-02-17T06:29:22.622452,2025-12-02T06:29:22.622452,Email thread with Jessica Vasquez on 2024-05-26
OPP34a7e4d1-cf4d-4f87-ade0-f539253a974c,EMPec58906b,Fuller-Lee,ROI,92301.99,2025-01-08T06:29:22.622452,2025-12-02T06:29:22.622452,Email thread with Chad Morris on 2024-04-23
OPP57f599d1-732a-4464-8f76-2ef8ccc6315b,EMPec58906b,Martin and Sons,Legal,86205.56,2025-01-27T06:29:22.622452,2025-12-02T06:29:22.622452,Email thread with Regina Crawford on 2024-02-07
OPP71daae43-9ac3-42cc-9615-16b5896431bf,EMPec58906b,"Stewart, Miller and Stewart",Legal,91812.33,2025-05-11T06:29:22.623449,2025-12-02T06:29:22.623449,Email thread with Henry Reeves on 2024-02-15
OPPc2450788-5272-498f-a0fb-ba8f1cc99fcc,EMPec58906b,Collins-Chase,Closed Won,117757.59,2025-02-09T06:29:22.623449,2025-12-02T06:29:22.623449,Email thread with Chelsea Banks on 2024-09-05
OPP8eca745c-d90f-4bbc-ab75-13d82fc1ea7d,EMPbec03f2a,Alvarez and Sons,ROI,142073.52,2025-01-31T06:29:22.623449,2025-12-02T06:29:22.623449,Email thread with Joseph Green on 2024-09-30
OPPbe850394-60fc-44e8-8d0d-82f91b13a405,EMPbec03f2a,Myers Group,Proposal,141429.92,2025-02-21T06:29:22.624448,2025-12-02T06:29:22.624448,Email thread with Michelle Brown on 2024-02-13
OPPd5be1022-1ea7-4756-a1d5-77a426b4a0a7,EMPbec03f2a,Lawson-Davis,Demo Conducted,74741.58,2025-01-14T06:29:22.624448,2025-12-02T06:29:22.624448,Email thread with Kevin Robinson on 2024-10-17
OPPd370bdf9-d85d-47fe-8d58-66cee64f0edb,EMPbec03f2a,Barrera-Schmidt,ROI,81416.81,2025-04-30T06:29:22.624448,2025-12-02T06:29:22.624448,Email thread with Pamela Sims on 2024-09-08
OPPe48f5984-42c9-4740-a757-af74cefad840,EMPbec03f2a,Moon Ltd,Closed Lost,70588.08,2025-02-16T06:29:22.625478,2025-12-02T06:29:22.625478,Email thread with Mark Montoya on 2024-10-24
OPP74b20954-bc51-45e7-acfd-01305b8a762f,EMPbec03f2a,"Davenport, Rivera and Coleman",Proposal,102148.44,2025-04-13T06:29:22.625478,2025-12-02T06:29:22.625478,Email thread with Elizabeth Lamb on 2024-02-24
OPP39e6f58f-7fdf-4229-ace4-2e4159616401,EMPbec03f2a,Brown Group,Legal,122722.39,2025-03-18T06:29:22.625478,2025-12-02T06:29:22.625478,Email thread with Isaac Walker on 2024-05-05
OPP9def8df6-3ca3-48ca-b307-60dc224c85db,EMPbec03f2a,"Edwards, Crawford and Cooper",Closed Won,68245.32,2025-03-10T06:29:22.626442,2025-12-02T06:29:22.626442,Email thread with Selena Valenzuela on 2024-09-14
OPP4bc61ffd-c610-43ed-851b-1c8ce0c012d2,EMPbec03f2a,Dean PLC,Closed Won,61859.46,2025-01-28T06:29:22.626442,2025-12-02T06:29:22.626442,Email thread with Denise Mason on 2024-10-02
OPP70910cca-4fd0-4da2-9c32-a1ded54f58b7,EMPc65195b7,Rodriguez Group,Closed Won,56427.31,2025-01-03T06:29:22.626442,2025-12-02T06:29:22.626442,Email thread with Kelsey Salazar on 2024-07-31
OPPdec0efbf-6033-4ee9-a8b1-2ccabcc0cdcf,EMPc65195b7,Stewart-Flynn,Demo Conducted,118975.16,2025-02-13T06:29:22.627439,2025-12-02T06:29:22.627439,Email thread with Gary Snyder on 2024-07-20
OPP06ab5a91-d83d-424b-bcd8-d4e4b8d056c1,EMPc65195b7,"Olson, Taylor and Miller",Closed Won,139609.31,2025-05-07T06:29:22.627439,2025-12-02T06:29:22.627439,Email thread with Sarah Hubbard on 2024-02-12
OPP4fd43443-e84b-40ec-9235-fb420e11f795,EMPc65195b7,"Lee, Brown and Williams",Closed Lost,79387.13,2025-05-09T06:29:22.627439,2025-12-02T06:29:22.627439,Email thread with Christopher Glover on 2024-05-28
OPP87b8d77e-f397-4943-a640-ca97fc88e170,EMPc65195b7,"Gregory, Richardson and Barnes",Case Evaluation,129760.71,2025-01-08T06:29:22.628436,2025-12-02T06:29:22.628436,Email thread with Andrew Doyle on 2024-08-08
OPPbce77742-7228-4d9a-a2cd-813001e1dd8c,EMP577255a4,Perry and Sons,Closed Won,77004.93,2025-05-14T06:29:22.628436,2025-12-02T06:29:22.628436,Email thread with Mark Velazquez on 2024-11-01
OPPe20e2224-47d3-4352-8019-fdfa510020c1,EMP577255a4,Waters-Chavez,Closed Lost,115350.95,2025-04-28T06:29:22.628436,2025-12-02T06:29:22.628436,Email thread with Katherine Lamb on 2024-07-19
OPPca968927-7194-4669-8dea-a29bdebec758,EMP577255a4,"Rivera, Lambert and Spears",Legal,89539.03,2025-05-16T06:29:22.628436,2025-12-02T06:29:22.628436,Email thread with Nicole Mcfarland MD on 2024-11-22
OPPc0b2ae8b-7788-4200-b6bd-58d6e8c2215d,EMP577255a4,Powell-Stevenson,Discovery,137869.9,2025-01-15T06:29:22.629433,2025-12-02T06:29:22.629433,Email thread with Tanya Fleming on 2024-03-10
OPPfe31866f-f37b-4601-b0bb-83947a31daf1,EMP577255a4,Weber and Sons,Discovery,89383.18,2025-02-28T06:29:22.629433,2025-12-02T06:29:22.629433,Email thread with Timothy Shaw on 2024-07-15
OPP2f595bc0-dad1-4c2b-9656-1c9429efcdfc,EMP577255a4,"Washington, Olson and Wright",Demo Conducted,94382.01,2025-04-18T06:29:22.629433,2025-12-02T06:29:22.629433,Email thread with Audrey Mcmillan on 2024-07-19
OPPfe9e5d82-bcbb-41f9-b3f8-55c809c9a8dc,EMP577255a4,Clarke Ltd,Demo Conducted,113669.55,2025-04-29T06:29:22.630431,2025-12-02T06:29:22.630431,Email thread with Todd Taylor on 2024-08-06
OPP5dbfc02b-5bee-41e1-a566-0feb35b996bd,EMP577255a4,Davis Group,Case Evaluation,125018.96,2025-01-22T06:29:22.630431,2025-12-02T06:29:22.630431,Email thread with Kenneth Boyd on 2024-08-23
OPP91f1955c-98e1-4c4a-8374-18f239499369,EMP577255a4,Morrison-Davis,ROI,78083.37,2025-01-19T06:29:22.630431,2025-12-02T06:29:22.630431,Email thread with Willie Curry on 2024-03-14
OPP2d8cf7e1-2158-4621-b79f-3b37f0c0dc32,EMP577255a4,"Baker, Sparks and Nguyen",Closed Won,126264.4,2025-03-07T06:29:22.631429,2025-12-02T06:29:22.631429,Email thread with Michael Payne on 2024-10-20
OPP0ff34b4c-02f2-4a9e-a574-75fd1720b8b4,EMP577255a4,Cooper and Sons,Case Evaluation,136044.18,2025-05-05T06:29:22.631429,2025-12-02T06:29:22.631429,Email thread with Tammy Lawrence on 2024-05-07
OPP7e41b9af-9ba7-4849-bb51-a1fa10c565d5,EMP577255a4,Sanchez-Savage,Demo Conducted,87511.42,2025-04-09T06:29:22.631429,2025-12-02T06:29:22.631429,Email thread with Gary Spence on 2024-08-05
OPP01975d43-754c-47c0-b19e-9ea946ad6171,EMP84dda756,"Garrett, Gates and Navarro",Closed Lost,50000.0,2025-02-10T06:29:22.632426,2025-12-02T06:29:22.632426,Email thread with Mrs. Natasha Kirk DDS on 2024-11-03
OPP4593b102-f9ae-4048-91b4-a4fe63ba4dc3,EMP84dda756,Campbell-Sullivan,Legal,72310.9,2025-01-01T06:29:22.632426,2025-12-02T06:29:22.632426,Email thread with Taylor Shepherd on 2024-02-21
OPP545dfd16-4cf2-4732-9190-78b1ce8af4d8,EMP84dda756,Lawson-Burns,Closed Lost,128738.3,2025-02-23T06:29:22.632426,2025-12-02T06:29:22.632426,Email thread with Lee Solomon on 2024-06-09
OPPd9f415ff-4c78-4b1e-86d3-41c5ceb885eb,EMP84dda756,Crane and Sons,Closed Won,133651.52,2025-04-22T06:29:22.633424,2025-12-02T06:29:22.633424,Email thread with Sean Hunt on 2024-06-24
OPP88c15972-ec73-4312-90a5-8c1fdeaf5252,EMP84dda756,"Osborne, Solomon and Underwood",Case Evaluation,94834.62,2025-03-22T06:29:22.633424,2025-12-02T06:29:22.633424,Email thread with Michael Hoffman on 2024-08-17
OPP17c98c2e-151a-4787-903e-6d922b243c58,EMP84dda756,Rodriguez Group,Demo Conducted,50990.94,2025-03-11T06:29:22.634419,2025-12-02T06:29:22.634419,Email thread with Michelle Bruce DVM on 2024-01-11
OPP546e8226-604f-44fe-9b69-0711cb1dad0d,EMP84dda756,Kelly-King,Discovery,79288.73,2025-02-14T06:29:22.634419,2025-12-02T06:29:22.634419,Email thread with Nicole Rush on 2024-04-30
OPPe97a194e-6ef9-4741-b21e-4596dfa1084f,EMP84dda756,Liu Ltd,Case Evaluation,125274.83,2025-04-04T06:29:22.635417,2025-12-02T06:29:22.635417,Email thread with Alexis Weiss on 2024-10-10
OPPcccf980d-b6aa-46d2-bdab-0bc2654075ad,EMP84dda756,Lewis-Arellano,Demo Conducted,122601.32,2025-05-07T06:29:22.635417,2025-12-02T06:29:22.636415,Email thread with Robert Thompson on 2024-10-05
OPPf85cfc9e-cf13-4e07-b31f-cd7247f559ef,EMP84dda756,Gomez Group,Case Evaluation,79881.44,2025-03-21T06:29:22.636415,2025-12-02T06:29:22.636415,Email thread with Robert Page on 2024-08-29
OPP67ddf42d-dd76-4afc-aaee-0157d3e4df8f,EMP84dda756,Estrada Inc,Discovery,55220.63,2025-02-10T06:29:22.636415,2025-12-02T06:29:22.636415,Email thread with Tammy Jenkins on 2024-01-30
OPP892324d6-3ffd-431f-91c7-3e1dad358ffc,EMP69e73dc3,Robinson Ltd,Legal,76675.95,2025-04-13T06:29:22.636415,2025-12-02T06:29:22.636415,Email thread with Justin Franklin on 2024-02-08
OPPe56a3078-cf7d-411b-ab67-5ae0c5d21579,EMP69e73dc3,Cannon PLC,ROI,58877.3,2025-05-14T06:29:22.637413,2025-12-02T06:29:22.637413,Email thread with Shelly Kim on 2024-04-11
OPP7e5c99ac-0f95-488a-8960-0a0436bbde06,EMP69e73dc3,Smith Inc,Proposal,150000.0,2025-03-04T06:29:22.637413,2025-12-02T06:29:22.637413,Email thread with Carolyn Fischer on 2024-03-18
OPPbd9a324e-932b-49a5-8a78-9a0e855f27d4,EMP69e73dc3,"Miller, Watson and Gardner",Closed Lost,135555.91,2025-05-29T06:29:22.637413,2025-12-02T06:29:22.637413,Email thread with Sophia Oliver on 2024-09-11
OPPcabfcd94-8bea-4e4d-a4f4-40284f4f2f74,EMP69e73dc3,Carpenter Inc,Legal,72908.25,2025-04-06T06:29:22.638410,2025-12-02T06:29:22.638410,Email thread with Heather Murphy on 2024-04-18
OPPd219c778-5891-4706-843b-5096d39e4b11,EMP69e73dc3,Evans and Sons,Discovery,114615.03,2025-04-18T06:29:22.638410,2025-12-02T06:29:22.638410,Email thread with Nathaniel Hood on 2024-08-19
OPP022b6290-6685-454e-917d-4cc0e8bb1f29,EMP69e73dc3,Hall-Jordan,Closed Won,105902.02,2025-03-05T06:29:22.638410,2025-12-02T06:29:22.638410,Email thread with Robert Thompson on 2024-08-10
OPPa5dc21c9-114a-4f8e-89b5-8d29744d7325,EMP69e73dc3,Barnett Inc,Proposal,106348.06,2025-05-18T06:29:22.639406,2025-12-02T06:29:22.639406,Email thread with James Thompson on 2024-03-26
OPP07a1cfb2-1b85-481d-8c49-8ceaa6a1e781,EMP69e73dc3,Foster LLC,Closed Won,91192.51,2025-01-14T06:29:22.639406,2025-12-02T06:29:22.639406,Email thread with James Santiago on 2024-09-01
OPPec52cef1-3374-463e-84cf-74466b82e781,EMP69e73dc3,"Cain, Carlson and Byrd",Closed Lost,146209.64,2025-05-25T06:29:22.639406,2025-12-02T06:29:22.639406,Email thread with Jose Mccoy on 2024-11-21
OPP752d67f6-569a-4d1f-b331-c18cd4055fa2,EMP69e73dc3,"White, Gonzalez and Johnson",Closed Lost,82650.5,2025-02-20T06:29:22.640433,2025-12-02T06:29:22.640433,Email thread with Peter Rivera on 2024-04-28
OPP938dc1b9-2e35-4409-a4d5-92f6cb574070,EMP39ea071b,"Perry, Brown and Reyes",Proposal,63568.22,2025-03-13T06:29:22.641403,2025-12-02T06:29:22.641403,Email thread with Nicole Villegas on 2024-11-29
OPPcad928d4-298c-453d-bf68-a5b3eaf9de49,EMP39ea071b,Floyd-Ortiz,ROI,95340.16,2025-01-07T06:29:22.641403,2025-12-02T06:29:22.641403,Email thread with Justin Ramos on 2024-08-29
OPPeb4194a0-5cd6-4445-9053-66ccb051460d,EMP39ea071b,Schneider PLC,Closed Lost,150000.0,2025-05-18T06:29:22.642399,2025-12-02T06:29:22.642399,Email thread with Jose Tucker on 2024-08-10
OPP1c6d0e35-8a50-42e2-9407-9f9eba95b4f6,EMP39ea071b,Hobbs LLC,Discovery,130317.63,2025-05-11T06:29:22.642399,2025-12-02T06:29:22.642399,Email thread with Brian Harvey on 2024-09-04
OPPca1871c6-9e7b-4789-873c-6d8bfeeb9881,EMP39ea071b,Payne LLC,Closed Won,96714.6,2025-02-26T06:29:22.642399,2025-12-02T06:29:22.642399,Email thread with Richard Taylor on 2024-07-19
OPPaac487b1-71db-4784-b71d-f25e3756af51,EMP39ea071b,"Nelson, Butler and Boyle",ROI,111291.11,2025-04-09T06:29:22.643397,2025-12-02T06:29:22.643397,Email thread with David Adams on 2024-05-10
OPPd6dffc21-b1c2-4d56-9ae3-237faa884965,EMP39ea071b,Vasquez-Guerra,Legal,117646.03,2025-03-29T06:29:22.643397,2025-12-02T06:29:22.643397,Email thread with Dennis Rodriguez on 2024-04-20
OPP3b8bb80d-572d-42ff-aaaa-5a3e31dbd1d5,EMPf72c685f,Krause and Sons,Legal,131741.11,2025-04-14T06:29:22.644394,2025-12-02T06:29:22.644394,Email thread with James Nichols on 2024-04-07
OPPf61d103d-f860-4014-ab3c-1658aa3042f9,EMPf72c685f,Mckee-Johnson,Proposal,85667.5,2025-02-19T06:29:22.644394,2025-12-02T06:29:22.644394,Email thread with Amanda Hamilton on 2024-02-12
OPP33744da6-b58e-4a1c-8df5-3f9b4102364b,EMPf72c685f,"Turner, Miller and Donaldson",Proposal,148863.05,2025-04-11T06:29:22.644394,2025-12-02T06:29:22.645391,Email thread with Jennifer Tran on 2024-03-10
OPP4980588c-1f35-440e-8c29-46f525bc36a3,EMPf72c685f,"Bradford, Stevenson and Phillips",Case Evaluation,110947.01,2025-04-26T06:29:22.645391,2025-12-02T06:29:22.645391,Email thread with Mr. Todd Sweeney on 2024-07-28
OPP13e34b3d-3d94-4990-b092-a5ff948c2d43,EMPf72c685f,Owen-Howard,Closed Won,99819.03,2025-01-30T06:29:22.645391,2025-12-02T06:29:22.645391,Email thread with Garrett Small on 2024-02-10
OPP76ad2cfc-23f4-4e14-bc8b-a273caa7b1c8,EMPf72c685f,"Bell, Anderson and Peck",Discovery,128108.99,2025-03-14T06:29:22.646387,2025-12-02T06:29:22.646387,Email thread with Randall Flores on 2024-08-24
OPP488d6a21-2415-42a3-bbef-34f04fc3489b,EMPf72c685f,Jenkins Inc,ROI,70579.04,2025-04-19T06:29:22.646387,2025-12-02T06:29:22.646387,Email thread with Christopher Hines on 2024-06-01
OPP1b742111-a032-443c-8ab8-78c73b342529,EMPf72c685f,Mcmahon-Potts,Discovery,150000.0,2025-03-16T06:29:22.646387,2025-12-02T06:29:22.646387,Email thread with Veronica Blankenship on 2024-08-07
OPPbde82282-fc76-4f58-a77e-03990c8dc79b,EMPf72c685f,Mills-Perez,Closed Won,95939.89,2025-01-14T06:29:22.647385,2025-12-02T06:29:22.647385,Email thread with Carla Pearson on 2024-02-15
OPP4bc3915a-2539-4d26-9af1-e66f890974e4,EMPf72c685f,Washington-Sanchez,Closed Won,111362.99,2025-05-25T06:29:22.647385,2025-12-02T06:29:22.647385,Email thread with Tara George on 2024-03-13
OPPc2c49a97-2e6f-4665-9776-da51f8c03d19,EMPf72c685f,"Dillon, Cook and Garcia",Case Evaluation,146306.32,2025-04-23T06:29:22.647385,2025-12-02T06:29:22.647385,Email thread with Steven Garcia on 2024-10-16
OPPec6b2ea2-f856-40c3-8fda-05f0e45d7a7c,EMPf72c685f,Fitzgerald Group,Discovery,76593.03,2025-01-19T06:29:22.648383,2025-12-02T06:29:22.648383,Email thread with Melissa Mahoney on 2024-04-21
OPP17323565-9dc2-47bd-a19d-ad4655cc0b0d,EMPf72c685f,Williams Group,Discovery,50000.0,2025-02-21T06:29:22.648383,2025-12-02T06:29:22.648383,Email thread with Michael Robinson on 2024-08-16
OPPb9167519-42a6-49a5-971c-f04de771edcc,EMPf72c685f,"Haynes, Jones and Poole",Proposal,80066.3,2025-03-04T06:29:22.648383,2025-12-02T06:29:22.648383,Email thread with Amanda Davis on 2024-10-02
OPP55b3b1ac-c349-40a7-bcfa-3a3b47f050aa,EMPf72c685f,Wallace-Cooper,Closed Lost,75666.33,2025-05-27T06:29:22.649382,2025-12-02T06:29:22.649382,Email thread with David Gomez on 2024-05-20
OPPf2aaaaf0-e8eb-4ae2-9bc1-c77afa29fad9,EMPb17c6279,"Brooks, Smith and Hanna",Proposal,79629.56,2025-04-11T06:29:22.650377,2025-12-02T06:29:22.650377,Email thread with Elizabeth Leon on 2024-01-09
OPP1e6ad906-e25c-43af-9ac7-9c048b8b435c,EMPb17c6279,Johnson-Thomas,Discovery,86744.87,2025-02-16T06:29:22.650377,2025-12-02T06:29:22.650377,Email thread with Amber Mcintyre on 2024-04-23
OPPa7b0a957-c0fa-4031-b26e-1983f6bd16ac,EMPb17c6279,Sanchez-Cunningham,Closed Won,86631.86,2025-01-06T06:29:22.651374,2025-12-02T06:29:22.651374,Email thread with Mary Stewart on 2024-09-02
OPP054efa50-4962-473b-a0f9-986ab2363b7e,EMPb17c6279,Murray Ltd,Discovery,74809.9,2025-01-19T06:29:22.651374,2025-12-02T06:29:22.651374,Email thread with Cindy Swanson on 2024-06-24
OPP00ac317a-dd82-4b3e-a868-5bdd02c81d11,EMPb17c6279,Armstrong Ltd,Closed Lost,101453.69,2025-05-09T06:29:22.652372,2025-12-02T06:29:22.652372,Email thread with Anna Saunders on 2024-09-16
OPP7f137c0d-39e6-4a53-9d59-195f39745c90,EMPb17c6279,Collins-Gibbs,Closed Won,76868.64,2025-02-22T06:29:22.652372,2025-12-02T06:29:22.652372,Email thread with Kimberly Duke on 2024-10-25
OPPed01d648-fcc5-4763-bf44-9eceb2db458c,EMPb17c6279,"Wagner, Cameron and Williams",Case Evaluation,150000.0,2025-04-10T06:29:22.653371,2025-12-02T06:29:22.653371,Email thread with Daniel Hall on 2024-02-24
OPP8f43392b-99b8-4f5c-8aa1-ee6f1b04eaa4,EMPb17c6279,Lawrence Ltd,Legal,98441.39,2025-03-14T06:29:22.653371,2025-12-02T06:29:22.653371,Email thread with Jessica Santos on 2024-06-02
OPPc330ad4f-9dcc-4998-bc6b-05350399a6c0,EMPb17c6279,"Warren, Macias and Flores",Proposal,107296.63,2025-01-11T06:29:22.653371,2025-12-02T06:29:22.653371,Email thread with Beth Evans on 2024-04-24
OPP858e8dfb-9846-4947-a6e0-a0aaac3d0478,EMP205291c9,Ellis PLC,ROI,139346.23,2025-03-07T06:29:22.654381,2025-12-02T06:29:22.654381,Email thread with James Hawkins on 2024-04-29
OPP50625b3b-d238-4cf5-9ef8-021cbce9ff07,EMP205291c9,"Bush, Scott and Horton",Legal,84579.86,2025-02-17T06:29:22.654381,2025-12-02T06:29:22.654381,Email thread with Jeremy Hendricks on 2024-11-12
OPP13843901-b020-48d4-929b-eb354fa09d36,EMP205291c9,"Graham, Peterson and Smith",Legal,95383.19,2025-02-10T06:29:22.655368,2025-12-02T06:29:22.655368,Email thread with Vincent Espinoza on 2024-11-19
OPP32476a22-8ea7-4cf1-9aff-2f2596bead62,EMP205291c9,"Nunez, Smith and Arias",Closed Won,100934.64,2025-02-22T06:29:22.655368,2025-12-02T06:29:22.655368,Email thread with Paul Rodriguez on 2024-09-15
OPPbda2d21f-7fe8-4e46-851c-d1e8e8294364,EMP205291c9,Hill PLC,Closed Won,103408.77,2025-05-16T06:29:22.655368,2025-12-02T06:29:22.655368,Email thread with Thomas Gonzalez on 2024-10-16
OPPe85c7c1b-7265-4014-9a79-45cf66c10396,EMP205291c9,Parker-Smith,Closed Won,72579.29,2025-05-12T06:29:22.655368,2025-12-02T06:29:22.655368,Email thread with Patty Pugh on 2024-10-27
OPPb187594d-577b-4f95-9b52-cc064b5e5471,EMP205291c9,Hernandez Group,Proposal,102077.5,2025-04-29T06:29:22.656365,2025-12-02T06:29:22.656365,Email thread with Gregory Weber on 2024-09-23
OPP38b48c97-c427-4f0a-bf9d-32abf28cd582,EMP205291c9,"White, Donaldson and Owens",Case Evaluation,120315.41,2025-03-01T06:29:22.656365,2025-12-02T06:29:22.656365,Email thread with Bradley Mcdaniel on 2024-03-07
OPP40400fe8-c68b-4f6e-8d5e-1bd98d832031,EMP95cf45c6,Burch-Cook,Case Evaluation,82907.35,2025-02-17T06:29:22.656365,2025-12-02T06:29:22.656365,Email thread with Michael Thompson on 2024-04-20
OPP8a6464fd-0b58-46c8-b9e3-2aa0e2238f55,EMP95cf45c6,"Turner, Middleton and Chang",Legal,137847.98,2025-05-31T06:29:22.657362,2025-12-02T06:29:22.657362,Email thread with Angela Meyers on 2024-11-18
