ticket_id,customer_id,issue_summary,status,tags,kb_reference,email_conversations
TICKf70c182c,CUST178d8aeb,"I'm experiencing significant delays when trying to load the dashboard on my account, which affects the ability to quickly access the necessary data for daily operations.",Resolved,"['table', 'arrive', 'all']",False,Email exchange with Austin Frank on 2024-04-10
TICKccb8123d,CUST67289142,"As a customer of CloudScape Technologies, I am facing an issue where the SaaS platform frequently logs me out, disrupting my workflow and causing productivity delays.",Closed,"['shake', 'sure', 'citizen']",False,Email exchange with Rebecca Anderson on 2023-12-15
TICK9d405ec8,CUSTd89d9c81,"""I am experiencing a significant lag when trying to access the analytics dashboard in our CloudScape platform, which is affecting our workflow efficiency.""",Pending,"['shoulder', 'language', 'policy']",False,Email exchange with Christopher Robinson on 2024-06-04
TICK8adbf40b,CUST93f69293,"I'm experiencing significant lag and slow performance while trying to access the dashboard through our SaaS platform, which is affecting our workflow efficiency.",Resolved,"['hot', 'box', 'job']",False,Email exchange with Amanda Williams on 2024-03-10
TICK9b6edd84,CUST0c64ac3b,I am experiencing a login issue where I am unable to access my account on CloudScape Technologies' platform even though I am entering the correct credentials.,Closed,"['study', 'friend', 'voice']",False,Email exchange with Douglas Kirby on 2024-08-15
TICK5d3a5e7f,CUST19c28c20,"The dashboard loads extremely slowly, making it difficult to access important features efficiently.",Closed,"['ask', 'family', 'page']",True,Email exchange with Fernando Fisher on 2024-10-19
TICK15efe3f7,CUST6ce59f5f,"""I'm experiencing intermittent login issues where the system occasionally fails to authenticate my credentials on the CloudScape platform.""",Pending,"['box', 'one', 'writer']",False,Email exchange with Jose Kelly on 2024-07-03
TICK2c0fe0c5,CUSTcbc0cc03,"I'm experiencing significant latency when trying to access real-time analytics on the CloudScape platform, which is affecting my ability to monitor current trends effectively.",Open,"['people', 'suddenly', 'drop']",True,Email exchange with Andrew Vasquez on 2024-01-15
TICK3fd9b785,CUST373bc03a,"I'm experiencing intermittent login issues where the system sometimes denies access with an error message, even though my credentials are correct.",Pending,"['special', 'offer', 'guy']",False,Email exchange with Amber Clayton on 2024-11-08
TICK07c63f41,CUST4e6fd0d4,I'm experiencing significant lag and delayed response times when using the dashboard feature in my CloudScape Technologies SaaS application.,Closed,"['good', 'sell', 'pick']",False,Email exchange with Nicholas Bradley on 2024-07-04
TICK3c886c28,CUST47b7fec9,"I'm experiencing slow loading times and frequent timeouts when trying to access the dashboard in our SaaS application, which is affecting our team's ability to perform tasks efficiently.",Open,"['act', 'card', 'imagine']",True,Email exchange with Curtis Carter on 2024-10-14
TICK86e44505,CUST14cea97e,Our team is experiencing intermittent login issues with CloudScape Technologies' platform where users are frequently being logged out unexpectedly.,Pending,"['his', 'talk', 'ahead']",True,Email exchange with Nicholas Bauer on 2024-04-22
TICK9e36c542,CUST2c90c6c8,"""When attempting to log in to CloudScape Technologies' platform, I encounter intermittent errors that prevent successful authentication, disrupting my access to necessary services.""",Open,"['person', 'inside', 'notice']",False,Email exchange with Nathan Hill on 2024-11-18
TICK9e27542a,CUST82ae55ee,"I'm experiencing intermittent login issues where I'm unable to access my account for CloudScape Technologies' service, often receiving a ""service unavailable"" error message.",Closed,"['sell', 'bring', 'book']",False,Email exchange with Rebecca Rodriguez on 2024-07-26
TICKb61cc105,CUSTf0976a64,"I'm experiencing sluggish performance with the dashboard analytics feature, causing delays in loading and processing data insights.",Pending,"['large', 'know', 'region']",False,Email exchange with Rebecca Hardin on 2024-01-01
TICK5b6a5eda,CUST14cea97e,I'm experiencing a login issue where I repeatedly receive an authentication error despite entering the correct credentials.,Pending,"['wide', 'these', 'threat']",True,Email exchange with James Walker on 2024-10-08
TICK194a11ee,CUST93c90f3e,"I am experiencing intermittent login issues with my CloudScape account, where the system sometimes fails to recognize my credentials even though they are entered correctly.",Closed,"['once', 'data', 'development']",False,Email exchange with Betty Welch on 2024-04-03
TICK064bab75,CUSTbcbb38cd,"The dashboard within our CloudScape user portal is taking an unusually long time to load, impacting our ability to monitor real-time analytics effectively.",Pending,"['take', 'good', 'name']",False,Email exchange with Melissa Cox on 2024-07-17
TICKd392458c,CUSTdecdf33b,I'm experiencing frequent timeouts and slow response times when trying to access our dashboard on CloudScape Technologies' platform.,Resolved,"['network', 'process', 'ever']",False,Email exchange with Luis Perez on 2024-10-25
TICK09e18684,CUSTebd54ab7,"""I am experiencing slow loading times when attempting to access CloudScape Technologies' dashboard, which is affecting productivity.""",Closed,"['person', 'turn', 'enough']",False,Email exchange with Katelyn Armstrong on 2024-11-02
TICKc5e61833,CUSTfa997180,I'm unable to log into the CloudScape portal as the system keeps displaying an 'Incorrect Password' message despite resetting it multiple times.,Closed,"['despite', 'up', 'its']",True,Email exchange with Brian Hobbs on 2024-07-08
TICKae80be58,CUSTb8962bb3,"I am experiencing intermittent login issues with CloudScape Technologies' SaaS platform, where I am frequently prompted for re-authentication despite having entered correct credentials.",Pending,"['world', 'she', 'someone']",False,Email exchange with Francis Anderson on 2024-09-29
TICK96774797,CUSTa2cd929c,"""I'm experiencing performance issues with the CloudScape platform where the dashboard takes an excessively long time to load.""",Resolved,"['quality', 'one', 'interesting']",False,Email exchange with Whitney Montgomery on 2024-01-25
TICKfa6d5fc4,CUSTa840175c,"I am experiencing a technical issue where the SaaS platform becomes unresponsive and freezes intermittently during peak usage hours, impacting my ability to perform critical operations efficiently.",Closed,"['nearly', 'fast', 'kid']",True,Email exchange with Jason Smith on 2024-09-02
TICK4b102d89,CUST01ec63ac,I'm experiencing frequent timeouts when trying to access the project dashboard on CloudScape Technologies' platform.,Open,"['analysis', 'understand', 'we']",True,Email exchange with Brenda Robertson on 2024-01-01
TICKdadd6b11,CUSTe12b8f30,"I'm experiencing frequent login failures with my CloudScape account, despite entering the correct credentials, which indicates a potential issue with the authentication system.",Open,"['wide', 'alone', 'public']",False,Email exchange with Mary Nelson on 2024-04-15
TICKe1f04211,CUST59976b9b,"I'm experiencing prolonged loading times when accessing the dashboard on CloudScape Technologies' platform, which is affecting my ability to analyze data efficiently.",Closed,"['task', 'some', 'power']",False,Email exchange with Timothy Brown on 2024-04-18
TICK617a2f07,CUST3cb8c5a4,"I'm experiencing intermittent login issues where the authentication process times out, preventing me from accessing my company's CloudScape SaaS dashboard efficiently.",Pending,"['run', 'race', 'business']",True,Email exchange with Derek Rogers on 2024-05-07
TICK6664a06d,CUST19c28c20,"I'm encountering login issues with CloudScape Technologies' platform, as it repeatedly fails to recognize my credentials despite being correct.",Open,"['certain', 'explain', 'eat']",False,Email exchange with Ryan Vasquez on 2024-11-22
TICKab125d1b,CUST45301bf9,"I am experiencing frequent login failures with CloudScape's SaaS platform where my credentials are not being recognized, despite them being correct.",Closed,"['while', 'thus', 'if']",False,Email exchange with Amy Baker on 2024-05-17
TICK766457d7,CUST0306895b,"Dustin Rangel from Sosa, Rivas and Ray is experiencing a technical issue where the SaaS platform by CloudScape Technologies frequently logs out users unexpectedly during active sessions, disrupting ongoing work processes.",Resolved,"['approach', 'others', 'western']",True,Email exchange with Dustin Rangel on 2024-08-12
TICK57ba9c35,CUST64fff1db,"""I am experiencing intermittent login failures when trying to access my account on CloudScape Technologies' platform despite entering the correct credentials.""",Resolved,"['generation', 'give', 'building']",False,Email exchange with William Gonzalez on 2024-07-28
TICK5515a89e,CUSTabd5cd71,"I am experiencing a persistent login issue where my credentials are repeatedly rejected, even though I am certain they are correct.",Resolved,"['decide', 'toward', 'Democrat']",True,Email exchange with Barbara Riggs on 2023-12-04
TICKd5ae8e24,CUST20901d4b,"I am experiencing frequent login timeouts when trying to access the CloudScape Technologies dashboard, causing disruption in my workflow.",Resolved,"['really', 'simple', 'Congress']",False,Email exchange with Tracy Reed on 2024-02-21
TICK5ec4ccb0,CUSTcbc0cc03,I'm experiencing a persistent login issue where my credentials are not being recognized by the CloudScape SaaS platform despite repeated attempts and resetting my password multiple times.,Closed,"['today', 'upon', 'protect']",True,Email exchange with Shawn Caldwell on 2024-10-30
TICK4827aacb,CUSTf5b5009c,I am experiencing intermittent login issues where the system does not recognize my credentials even though they are correct.,Resolved,"['despite', 'ground', 'believe']",True,Email exchange with Melinda King on 2024-01-09
TICK171db048,CUST6ce59f5f,"I am experiencing a performance problem where the dashboard takes an extremely long time to load, affecting my ability to efficiently manage my tasks.",Resolved,"['moment', 'particularly', 'difference']",False,Email exchange with Kayla Doyle on 2024-07-06
TICK4cdacdbe,CUST93f69293,"I'm experiencing intermittent login failures when trying to access the CloudScape dashboard, which hinders my ability to manage our company's services efficiently.",Pending,"['store', 'dinner', 'Mr']",False,Email exchange with Ashley Cantrell on 2024-01-08
TICK23db8126,CUST36017fde,"""I'm experiencing prolonged loading times and occasional timeouts when trying to access the analytics dashboard on CloudScape Technologies' platform.""",Open,"['go', 'enter', 'Mr']",True,Email exchange with Heather Hernandez on 2024-02-28
TICKe74083d5,CUST08112d34,"I'm experiencing significant delays when trying to access the analytics dashboard in the CloudScape Technologies platform, causing workflow disruptions.",Closed,"['box', 'evidence', 'lay']",False,Email exchange with Nicholas Yates on 2024-08-04
TICK4d6cb7c7,CUST460d4241,"I'm experiencing a significant slowdown in application performance, especially during peak usage hours, causing delays in completing important tasks.",Closed,"['me', 'officer', 'old']",False,Email exchange with Carrie Lam on 2024-02-29
TICK34e262e8,CUSTd89d9c81,"I'm experiencing persistent login issues on the CloudScape platform, where the system fails to authenticate my credentials despite entering the correct username and password.",Closed,"['blood', 'station', 'always']",False,Email exchange with Thomas Nielsen on 2024-01-07
TICK28dece76,CUST1ea7c51a,"I am experiencing a significant delay in loading data on the CloudScape platform, which is affecting the performance of our team's daily operations.",Open,"['send', 'over', 'arm']",False,Email exchange with Cynthia Woods on 2024-05-29
TICKb7e4e09e,CUST25f9ca4f,"As a customer from Martinez, Howard and Le, I'm experiencing intermittent login failures with CloudScape Technologies' platform, despite having verified my credentials.",Resolved,"['list', 'little', 'defense']",True,Email exchange with Jeffery Galvan on 2024-11-29
TICK6e7eb7a3,CUSTd225e373,I am experiencing slow application performance and frequent timeouts when attempting to access our SaaS dashboard provided by CloudScape Technologies.,Pending,"['store', 'floor', 'story']",True,Email exchange with Whitney Conner on 2024-07-08
TICKe3afcc74,CUSTcd621d3d,I am experiencing a login issue where I am unable to access my account despite entering the correct credentials.,Open,"['fear', 'billion', 'effect']",True,Email exchange with Robert Bell on 2024-11-03
TICK501fdd1e,CUSTea51dcff,I am experiencing a performance issue where reports take significantly longer to load than usual on the CloudScape Technologies SaaS platform.,Pending,"['instead', 'fund', 'factor']",True,Email exchange with Timothy Murray on 2024-02-27
TICK252949dc,CUST46ccd432,"Emma Lynch from Adams LLC is experiencing prolonged loading times and lag while using the analytics dashboard in CloudScape Technologies' application, making it difficult to efficiently access and interpret data.",Pending,"['language', 'trouble', 'end']",True,Email exchange with Emma Lynch on 2024-02-22
TICKd4a390f7,CUSTbbdbbee0,"""I'm experiencing intermittent login issues with CloudScape Technologies' platform, where the system either takes a long time to authenticate or fails to log me in altogether.""",Pending,"['price', 'team', 'bill']",False,Email exchange with Mr. Jason Marsh on 2024-04-07
TICK36c509ce,CUST14cea97e,"I am experiencing significant performance issues with slow loading times on the CloudScape dashboard, which is hindering my team's productivity.",Closed,"['attention', 'bill', 'include']",True,Email exchange with Christopher Hines on 2024-06-03
TICK9947d322,CUST5544e6d4,I'm experiencing slow loading times when trying to access the dashboard on CloudScape Technologies' platform.,Resolved,"['case', 'economy', 'certainly']",True,Email exchange with Crystal Garrett on 2023-12-15
TICKccaad951,CUSTe6e294dd,"""I'm experiencing login issues with CloudScape Technologies' platform, as it keeps displaying an authentication error despite entering the correct credentials.""",Open,"['measure', 'cut', 'support']",False,Email exchange with Mark Silva on 2024-05-23
TICKe49eca3a,CUST7320fab4,"I'm experiencing frequent login timeouts when trying to access the CloudScape Technologies dashboard, despite having a stable internet connection and correct login credentials.",Pending,"['contain', 'sense', 'find']",False,Email exchange with Joshua Johnson on 2024-01-08
TICK45d67e03,CUST373bc03a,I'm experiencing intermittent login issues where my session frequently expires despite active use.,Open,"['church', 'what', 'garden']",True,Email exchange with William Gutierrez on 2024-02-25
TICKf973a977,CUST67289142,"""I'm experiencing persistent login issues with CloudScape Technologies' platform where the system repeatedly logs me out unexpectedly.""",Pending,"['range', 'maybe', 'everybody']",True,Email exchange with Stephen Sanchez on 2024-09-30
TICKe3df7117,CUSTe585a64d,"As a customer, I'm experiencing significant delays and timeouts when trying to access the analytics dashboard on CloudScape Technologies' platform.",Closed,"['relationship', 'collection', 'player']",False,Email exchange with Ashley Wilson on 2024-02-21
TICKed897f3d,CUST3e719c54,"I'm experiencing a significant delay in loading times while using the analytics dashboard, which is affecting my ability to access real-time data efficiently.",Resolved,"['law', 'everybody', 'in']",True,Email exchange with Elizabeth Washington on 2024-02-02
TICK509af891,CUST8f056f5b,"I'm experiencing intermittent login issues with CloudScape Technologies' platform, where the system sometimes fails to authenticate my credentials despite entering them correctly.",Pending,"['there', 'over', 'international']",False,Email exchange with Richard Velazquez on 2024-04-14
TICK1d9fcdd2,CUST0a799057,"We're experiencing performance issues with CloudScape Technologies' dashboards; they are taking significantly longer to load than usual, impacting our team's workflow efficiency.",Closed,"['might', 'break', 'success']",False,Email exchange with Chelsea Peterson on 2024-02-29
TICKd3a3dfe5,CUST56034d56,"I'm experiencing a delay in data synchronization across devices when using CloudScape Technologies' services, causing inconsistencies in the information displayed on different platforms.",Open,"['politics', 'well', 'hair']",False,Email exchange with Sharon Cook on 2024-08-20
TICKe43e0658,CUST2c90c6c8,"I am experiencing frequent login timeouts when trying to access our company's dashboard on CloudScape Technologies' platform, despite having a stable internet connection.",Resolved,"['development', 'indicate', 'down']",True,Email exchange with Ernest Snow on 2024-03-21
TICKa9102899,CUST915a7a88,"I am experiencing a login issue where my credentials are not recognized despite being correct, which prevents me from accessing the dashboard on CloudScape's platform.",Resolved,"['focus', 'like', 'true']",True,Email exchange with Patrick Hoffman on 2024-11-08
TICK60b8ccd6,CUST1ebbf927,"We are experiencing intermittent login failures with our CloudScape dashboard, preventing some team members from accessing critical data and tools.",Open,"['catch', 'share', 'pick']",False,Email exchange with Nancy Woods on 2024-06-27
TICK13fe223f,CUST53080554,I am unable to access my account due to persistent login errors despite using the correct credentials on CloudScape Technologies' platform.,Pending,"['age', 'so', 'anything']",True,Email exchange with Tammy Snyder on 2023-12-20
TICKde9cc126,CUSTa7119e94,I am experiencing intermittent login issues where the system sometimes fails to authenticate my credentials on the CloudScape Technologies platform.,Pending,"['town', 'others', 'factor']",False,Email exchange with Luis Clark on 2023-12-02
TICK1dc93440,CUSTa7119e94,"I'm experiencing a feature malfunction where the data analytics dashboard is not loading properly, causing delays in accessing essential reports.",Pending,"['particularly', 'forward', 'ago']",False,Email exchange with Jennifer Hunt on 2024-04-17
TICKaa59cb82,CUST14cea97e,I'm experiencing intermittent login issues where the system occasionally fails to recognize my credentials on the CloudScape Technologies platform.,Resolved,"['southern', 'record', 'by']",True,Email exchange with William Strong on 2024-07-27
TICKc18e19e6,CUST88cb70b8,"I am experiencing a consistent login failure when attempting to access our company's dashboard on CloudScape Technologies' platform, receiving an error message stating ""authentication service temporarily unavailable.""",Pending,"['investment', 'price', 'first']",True,Email exchange with Richard Haynes on 2024-05-23
TICKdb485118,CUST681bcf06,"I am unable to access my dashboard due to repeated login issues, where my credentials are incorrectly being flagged as invalid.",Pending,"['side', 'society', 'ago']",False,Email exchange with Ronald Lloyd on 2024-07-09
TICK3f93765c,CUST36288363,I am unable to access the dashboard as it continuously times out and displays an error message.,Closed,"['teacher', 'already', 'last']",False,Email exchange with Brent Michael on 2024-11-24
TICKd72eaad6,CUST36017fde,I'm experiencing slow performance and frequent timeouts when trying to access the reporting features of CloudScape Technologies' SaaS platform.,Closed,"['study', 'process', 'official']",False,Email exchange with Phillip King on 2024-10-02
TICK2774f778,CUSTb8962bb3,I'm experiencing performance problems with slow load times when accessing the dashboard on CloudScape Technologies' platform.,Closed,"['glass', 'quickly', 'agree']",False,Email exchange with Nicholas Little on 2024-11-13
TICK62a1ecc3,CUST4cc0ee13,"I am experiencing frequent login timeouts when trying to access the dashboard on CloudScape Technologies' platform, which disrupts my workflow.",Open,"['only', 'idea', 'born']",False,Email exchange with Monica Rowland on 2024-05-11
TICK454e1bb5,CUST82ae55ee,"I'm experiencing a recurring issue where the SaaS platform frequently logs me out, forcing me to re-enter my credentials multiple times throughout the day, which disrupts my workflow.",Resolved,"['such', 'group', 'another']",False,Email exchange with Michelle Harris on 2023-12-24
TICK4e23187f,CUST4e6fd0d4,"I'm experiencing frequent timeouts and slow loading times when trying to access the dashboard in CloudScape Technologies' SaaS platform, affecting my workflow efficiency.",Resolved,"['eye', 'stuff', 'since']",False,Email exchange with Mark Ryan on 2023-12-16
TICKc544a858,CUST5544e6d4,I'm experiencing frequent timeouts and slow performance when trying to access my dashboard on CloudScape Technologies' platform.,Resolved,"['drive', 'TV', 'southern']",True,Email exchange with Larry Gardner on 2024-01-14
TICK65fe6d81,CUST0b1d18d5,"I'm experiencing frequent login timeouts and intermittent access to the dashboard, which seems to be a common issue with SaaS performance and user authentication services.",Open,"['happy', 'ready', 'summer']",True,Email exchange with Emily Hamilton on 2024-08-17
TICKcc6a226c,CUST88cb70b8,"I am experiencing intermittent login issues where the authentication process occasionally fails, requiring me to repeatedly attempt to log in.",Open,"['road', 'skill', 'try']",False,Email exchange with Calvin Douglas on 2023-12-05
TICK850e86a0,CUST58dbce03,"""I am experiencing frequent login timeout errors when trying to access the dashboard, causing disruption to my workflow.""",Pending,"['billion', 'they', 'page']",True,Email exchange with Tracey Molina on 2024-09-17
TICKcb6f58cb,CUSTa840175c,"I am experiencing frequent timeout errors when trying to access the analytics dashboard, which is affecting my ability to generate performance reports for my team.",Closed,"['under', 'professor', 'never']",True,Email exchange with Zachary Miller on 2024-07-31
TICK99bebc96,CUST36288363,"""I'm experiencing significant lag and slow performance when trying to access the dashboard of our SaaS application, which is affecting our workflow.""",Open,"['now', 'already', 'difference']",False,Email exchange with Jeffrey Newman on 2024-07-16
TICK4434d7c7,CUST7320fab4,"We are experiencing intermittent login failures when trying to access the CloudScape Technologies dashboard, causing disruptions in our workflow management.",Open,"['blood', 'box', 'course']",False,Email exchange with Donna Brown on 2024-01-16
TICKf4f814c0,CUST9c3a1f72,"I am experiencing slow load times when accessing the dashboard on CloudScape Technologies' platform, which is affecting my ability to manage my projects efficiently.",Closed,"['white', 'ever', 'instead']",False,Email exchange with Todd Lewis on 2024-02-17
TICKe9bfa61b,CUST0787ac4a,"I'm experiencing intermittent login issues where the system frequently logs me out and requires repeated authentication, disrupting my workflow.",Resolved,"['partner', 'its', 'their']",False,Email exchange with Jodi Moore on 2024-03-17
TICK82ae21ff,CUST36c6ddd4,"The dashboard is taking too long to load, causing delays in accessing necessary data and insights for decision-making.",Pending,"['spring', 'push', 'true']",True,Email exchange with Kenneth Frazier on 2024-06-23
TICKcc298110,CUST4d1fe908,"I am experiencing prolonged loading times when accessing the dashboard on CloudScape Technologies' platform, which is impacting productivity.",Pending,"['during', 'meeting', 'why']",False,Email exchange with Jacob Brown on 2024-07-21
TICK5d4cc0ee,CUSTf5922c31,I am experiencing intermittent performance issues where the software takes an unusually long time to load certain features.,Resolved,"['travel', 'clearly', 'once']",False,Email exchange with Darrell Scott on 2024-03-01
TICK18cbb50a,CUST36c6ddd4,"As a customer from Jones LLC using CloudScape Technologies, I'm experiencing a login issue where the authentication system repeatedly fails to recognize my credentials, preventing access to my account.",Closed,"['today', 'bad', 'try']",False,Email exchange with Jade Pena on 2024-02-26
TICKa5de7d64,CUST5ac52854,"I am experiencing login issues with my CloudScape account, as it frequently fails to authenticate, causing disruptions in accessing my SaaS services.",Pending,"['approach', 'nearly', 'next']",True,Email exchange with Matthew Hale on 2024-06-06
TICKb47237b4,CUSTe6e294dd,"""I'm unable to access my dashboard on CloudScape Technologies as the login page keeps freezing and timing out.""",Resolved,"['case', 'indeed', 'rock']",False,Email exchange with Miss Samantha Rowe on 2024-11-26
TICK4488c14f,CUSTee79c6b3,"I'm experiencing a persistent login issue where the system fails to recognize my credentials despite them being correct, and this is preventing me from accessing essential features of the service.",Closed,"['task', 'dark', 'often']",True,Email exchange with Patrick Mccarty on 2023-12-14
TICK7ca15f75,CUST479a1833,"I am experiencing login issues where the authentication process takes an unusually long time to complete, sometimes resulting in timeouts, which prevents me from accessing the CloudScape platform efficiently.",Resolved,"['clearly', 'leader', 'turn']",True,Email exchange with Brian Burke on 2024-08-17
TICK4c58d103,CUST443be750,"I'm experiencing performance problems where our analytics dashboard takes an unusually long time to load and update data, affecting our team's productivity.",Pending,"['military', 'kitchen', 'establish']",True,Email exchange with Ryan Lara on 2024-07-23
TICK427404d5,CUSTe6e294dd,"I am facing a performance issue where our cloud-based dashboard is loading extremely slowly, impacting our ability to monitor real-time data efficiently.",Pending,"['receive', 'low', 'attorney']",False,Email exchange with Matthew Foster on 2024-03-04
