ticket_id,customer_id,issue_summary,status,tags,kb_reference,email_conversations
TICK413000bb,CUST36017fde,I'm experiencing slow load times and frequent timeouts when attempting to access the analytics dashboard on CloudScape Technologies' platform.,Closed,"['system', 'need', 'talk']",True,Email exchange with Pamela Warren on 2024-03-12
TICK765efa31,CUSTa20dc54c,I am experiencing slow performance and frequent timeouts when accessing the reporting dashboard on CloudScape Technologies' platform.,Open,"['old', 'save', 'red']",True,Email exchange with Emma Boyd on 2024-04-29
TICK4156278e,CUSTea2c8680,I am experiencing a performance problem with slow loading times when accessing the dashboard in CloudScape Technologies' SaaS platform.,Resolved,"['media', 'reflect', 'loss']",False,Email exchange with Elijah Carter on 2024-07-18
TICKb51f6a03,CUST3c21bccd,"I am experiencing a performance problem with CloudScape Technologies' SaaS platform, where my dashboard is taking too long to load, affecting my productivity and efficiency.",Pending,"['blue', 'eight', 'issue']",False,Email exchange with Joseph Williams on 2024-06-24
TICKb5fd0ef3,CUSTbcbb38cd,"I am experiencing significant lag and slowdown when attempting to navigate through the dashboard interface on CloudScape Technologies' platform, affecting my ability to efficiently manage my tasks.",Open,"['clear', 'school', 'minute']",False,Email exchange with Danielle Long on 2024-09-13
TICKe1f8f87e,CUSTeb6f8e57,"I'm experiencing intermittent login failures when trying to access my account on the CloudScape Technologies platform, preventing me from using the service efficiently.",Open,"['under', 'food', 'imagine']",False,Email exchange with Elizabeth Martinez on 2024-07-13
TICK391cce79,CUST36c6ddd4,"Experiencing slow loading times and intermittent login failures on the CloudScape project management dashboard, which disrupts workflow efficiency.",Pending,"['beyond', 'floor', 'firm']",False,Email exchange with Michael Scott on 2024-02-13
TICKb0e79595,CUST13e8a578,"""As a customer of CloudScape Technologies, I am experiencing intermittent login issues where the system fails to recognize my credentials, despite them being entered correctly, leading to frequent lockouts and disrupted access to the services.""",Resolved,"['traditional', 'nor', 'more']",True,Email exchange with Debra Griffin on 2024-03-01
TICK3d7a955a,CUST0c64ac3b,"I am experiencing frequent login failures on the platform, which disrupt my workflow and productivity.",Pending,"['page', 'table', 'chair']",True,Email exchange with Rose Morris on 2023-12-18
TICK07ab875d,CUSTe34f2911,"I'm experiencing frequent login failures when trying to access CloudScape Technologies' dashboard, despite using the correct credentials.",Resolved,"['situation', 'suggest', 'kitchen']",False,Email exchange with Jeffrey Peterson on 2024-04-06
TICK83c2dfc1,CUST36706e7f,"I am experiencing a performance issue where the CloudScape portal loads very slowly, taking several minutes instead of seconds.",Open,"['during', 'thousand', 'attack']",True,Email exchange with Brian Sanford on 2024-03-25
TICKacef1be4,CUSTac69cc2a,"As a user from Holt PLC, I'm experiencing persistent login failures with CloudScape Technologies' platform, receiving an ""authentication error"" message despite entering correct credentials.",Pending,"['grow', 'window', 'that']",True,Email exchange with Sandra Garcia on 2024-09-05
TICK201dcb74,CUST25f9ca4f,"I'm having trouble accessing my CloudScape Technologies account due to persistent login issues, where my credentials are not being recognized.",Open,"['leader', 'expert', 'final']",False,Email exchange with Michael Smith on 2024-10-01
TICKfde79d0c,CUSTf6f45443,"""I am unable to access my dashboard on CloudScape Technologies as it keeps timing out whenever I try to log in from multiple devices simultaneously.""",Resolved,"['fly', 'education', 'travel']",True,Email exchange with Alicia Goodman on 2024-06-15
TICK641a055f,CUST8ea8e956,"""I'm experiencing prolonged response times when trying to access the dashboard on CloudScape Technologies' platform, hindering my team's ability to work efficiently.""",Resolved,"['thought', 'then', 'despite']",False,Email exchange with Maxwell Smith on 2024-10-22
TICKac09704d,CUSTfdc330ea,"""I am experiencing significant lag and slow performance when using the CloudScape Technologies dashboard, which is hindering my ability to manage our resources efficiently.""",Resolved,"['set', 'hundred', 'amount']",True,Email exchange with Denise Kent on 2024-03-12
TICK97ac90b5,CUST82ae55ee,"I am experiencing a performance problem with CloudScape Technologies' services where reports are taking an unusually long time to generate, affecting our team's productivity.",Open,"['election', 'face', 'necessary']",True,Email exchange with Thomas Gonzalez on 2024-11-28
TICK97a29600,CUSTee2907ae,"I'm experiencing a significant slowdown in application performance, making it difficult to complete tasks efficiently on CloudScape Technologies's platform.",Closed,"['husband', 'future', 'six']",False,Email exchange with Lindsey Velez on 2024-04-02
TICK70ab9665,CUSTe6ffd849,"I'm experiencing a persistent issue where the dashboard loads extremely slowly, making it difficult to efficiently analyze our data and insights.",Open,"['common', 'four', 'difference']",False,Email exchange with Adrian Trevino on 2024-05-10
TICKa84094db,CUST5c6a5f25,"Teresa Schroeder is experiencing slow loading times when accessing the analytics dashboard on CloudScape Technologies' platform, causing delays in retrieving essential data for her team at Tran Group.",Resolved,"['student', 'majority', 'trial']",True,Email exchange with Teresa Schroeder on 2024-10-24
TICK985fe3f0,CUSTd74b43d2,"I'm experiencing significant latency when trying to access the dashboard on CloudScape Technologies' platform, which hampers productivity.",Pending,"['stop', 'as', 'just']",False,Email exchange with Michael Hernandez on 2024-05-13
TICK7b91d598,CUSTd408d66d,"I'm experiencing frequent login failures on the CloudScape platform despite using the correct credentials, causing significant disruptions to my workflow.",Pending,"['evidence', 'across', 'in']",True,Email exchange with Robert Ramirez on 2024-04-30
TICK108c6bf6,CUST5ab7eb9c,I'm experiencing intermittent login issues where the system times out frequently when trying to access my dashboard using CloudScape Technologies' platform.,Open,"['goal', 'want', 'late']",False,Email exchange with Theresa Miranda on 2024-10-07
TICK01375173,CUST3979bcff,"I am experiencing frequent login timeouts and slow response times when accessing CloudScape Technologies' dashboard, which is affecting my ability to manage projects efficiently.",Pending,"['pay', 'maybe', 'less']",False,Email exchange with Kristen Gibson on 2024-08-19
TICK08710db5,CUSTa7119e94,"""I'm experiencing a significant lag in response time when trying to access the dashboard features of CloudScape's SaaS platform, which is impacting my ability to efficiently manage tasks.""",Open,"['economic', 'community', 'we']",False,Email exchange with Brandon Noble on 2024-10-28
TICKf91c8f52,CUST6441b64b,"I'm experiencing intermittent login issues with CloudScape Technologies' platform, where the system occasionally fails to authenticate my credentials correctly, leading to frequent disruptions.",Open,"['decide', 'ago', 'PM']",False,Email exchange with Kristen Rowe MD on 2024-02-01
TICK67edb988,CUST79ba873f,"I am experiencing a performance problem where the SaaS platform is running unusually slow, affecting our team's productivity.",Resolved,"['his', 'including', 'travel']",False,Email exchange with Heather Reyes on 2023-12-25
TICK9bc8c878,CUSTd225e373,"I am experiencing intermittent login issues where the system logs me out unexpectedly, disrupting my workflow.",Resolved,"['bill', 'compare', 'purpose']",False,Email exchange with Wesley Ware on 2024-01-15
TICK852f3b6d,CUST053df6d9,"""I'm experiencing intermittent login issues where I am unable to access my account dashboard on the CloudScape portal sporadically despite having entered the correct credentials.""",Resolved,"['bad', 'exist', 'choice']",True,Email exchange with Jonathan Flores on 2024-07-27
TICKf26e8881,CUSTd13d1a66,I am experiencing a persistent login issue where I am repeatedly prompted to enter my credentials despite having entered them correctly on CloudScape Technologies' SaaS platform.,Open,"['mouth', 'film', 'world']",False,Email exchange with Manuel Flores on 2024-09-16
TICK90f06789,CUST5ac52854,"I'm experiencing intermittent login failures when trying to access the dashboard of CloudScape Technologies, which has been disrupting my ability to monitor our platform's performance effectively.",Closed,"['American', 'computer', 'ready']",True,Email exchange with Mrs. Alicia Cole on 2024-10-29
TICK4c82c696,CUSTabd5cd71,"I am experiencing significant performance lags when trying to access the analytics dashboard, which is affecting my ability to generate real-time reports for our team.",Pending,"['share', 'go', 'large']",True,Email exchange with Heather Gilbert on 2024-01-23
TICK23de2d40,CUST53ed6746,"I am experiencing frequent timeouts and slow loading times when trying to access the dashboard on CloudScape Technologies' platform, making it difficult to manage our projects effectively.",Resolved,"['performance', 'address', 'whatever']",False,Email exchange with Katherine Griffin on 2024-01-02
TICK4fdff89a,CUST20901d4b,I am experiencing slow page load times and intermittent timeouts when accessing the dashboard feature in CloudScape Technologies' platform.,Closed,"['window', 'material', 'recently']",True,Email exchange with Vincent Wilson on 2024-07-09
TICK397ed360,CUSTeb6f8e57,"I am experiencing intermittent login issues where my credentials are not being recognized, despite being correct, which is affecting my access to CloudScape Technologies' platform.",Resolved,"['also', 'city', 'practice']",True,Email exchange with Jamie Conner on 2024-07-04
TICK806b6543,CUST479a1833,"I'm experiencing intermittent login failures when trying to access my account on CloudScape Technologies' platform, which makes it difficult to manage my work efficiently.",Closed,"['win', 'message', 'employee']",True,Email exchange with Linda Johnson on 2024-08-03
TICK0285ef68,CUSTeafecae0,"""I'm experiencing slow performance and frequent timeouts when trying to access the dashboard feature of CloudScape Technologies's services.""",Closed,"['benefit', 'treat', 'form']",False,Email exchange with Adam Coffey on 2023-12-10
TICKcabe6bf7,CUST36706e7f,"I'm experiencing intermittent performance degradation when accessing the analytics dashboard in our SaaS platform, which is causing delays in retrieving data and affects overall productivity.",Pending,"['power', 'spend', 'reach']",True,Email exchange with Christopher Garcia on 2024-02-03
TICK8d0c5d11,CUSTf5b5009c,"I'm experiencing intermittent login issues where the system fails to authenticate my credentials, causing delays in accessing my account.",Resolved,"['act', 'nearly', 'instead']",False,Email exchange with Jennifer Brown on 2024-04-15
TICKfc2a2ed1,CUST602c32b0,"""I am experiencing slow performance and frequent timeouts when attempting to access the dashboard on CloudScape Technologies' SaaS platform.""",Pending,"['fact', 'fish', 'should']",True,Email exchange with Anthony Scott on 2024-06-21
TICK05ad3926,CUST79ba873f,"I am experiencing intermittent login failures when trying to access my workspace on CloudScape Technologies' platform, which is disrupting my workflow.",Pending,"['daughter', 'employee', 'center']",True,Email exchange with Patricia Carpenter on 2023-12-05
TICK8be2119e,CUSTfd389ded,I'm experiencing performance issues where the dashboard is taking an unusually long time to load on CloudScape Technologies' platform.,Open,"['want', 'series', 'ahead']",False,Email exchange with Felicia Silva on 2024-05-19
TICK0e603941,CUST053df6d9,We are experiencing intermittent login failures where users are unable to access their accounts using the SaaS platform provided by CloudScape Technologies.,Open,"['Mr', 'each', 'event']",False,Email exchange with David Singh on 2024-04-24
TICK839b6987,CUST47b7fec9,"I'm experiencing a significant delay in loading dashboard analytics, causing disruptions in data visualization and hindering timely decision-making.",Resolved,"['again', 'I', 'man']",True,Email exchange with Joseph Smith on 2024-10-08
TICK2d8ca9eb,CUST3ae7d5ab,"I'm experiencing persistent loading errors when trying to access my dashboard on the SaaS platform, which seems to affect my ability to manage projects efficiently.",Pending,"['resource', 'under', 'maintain']",True,Email exchange with Emma Warren on 2024-09-04
TICKd3771bcf,CUSTa7119e94,"I'm experiencing significant performance issues with CloudScape Technologies' SaaS platform, as pages are taking unusually long to load and often time out during peak usage hours.",Open,"['program', 'break', 'trade']",True,Email exchange with Michelle Wilson on 2024-06-27
TICK67b9ccb8,CUST6441b64b,"""I'm experiencing intermittent login failures when trying to access our project management dashboard on CloudScape Technologies’ platform.""",Pending,"['artist', 'lead', 'trade']",False,Email exchange with Robert Ryan on 2024-05-22
TICKc95166a5,CUSTe6ffd849,"""Experiencing slow load times and unresponsive dashboards when accessing the analytics feature, hindering real-time data analysis.""",Open,"['middle', 'company', 'they']",False,Email exchange with Robert Allen on 2024-02-21
TICK094f6e0c,CUST36017fde,"""I'm experiencing slow performance when accessing the analytics dashboard on CloudScape Technologies' platform.""",Pending,"['new', 'control', 'together']",True,Email exchange with Johnny White III on 2024-01-31
TICK127d18a9,CUSTe880c5fb,"I'm experiencing slow performance speeds when accessing the data analytics feature on CloudScape Technologies' platform, causing delays in retrieving insights.",Closed,"['name', 'between', 'need']",True,Email exchange with Troy Phillips on 2024-02-22
TICK2611b628,CUSTd3c4487a,"I'm experiencing frequent login issues with CloudScape Technologies' platform, where the system repeatedly prompts for my credentials despite entering them correctly.",Resolved,"['simple', 'thus', 'operation']",False,Email exchange with Gloria Hill on 2024-11-22
TICKde34165d,CUST53ed6746,"Our team is experiencing intermittent performance issues with CloudScape Technologies' software, where page loading times have significantly increased, impacting our productivity.",Open,"['production', 'speech', 'seem']",True,Email exchange with Anthony Ware on 2024-10-24
TICKdb37f939,CUST6baf3601,I am unable to log into my CloudScape account as it keeps showing an authentication error despite using correct credentials.,Closed,"['represent', 'family', 'watch']",True,Email exchange with Ariel Barajas on 2024-01-02
TICK9f98aada,CUST4cc0ee13,"""I am experiencing slow performance and frequent timeouts when trying to access the analytics features on CloudScape Technologies' platform.""",Pending,"['sing', 'picture', 'artist']",True,Email exchange with Stephanie Martin on 2024-04-01
TICKb8581fe1,CUST0b1d18d5,I'm unable to log into my CloudScape account as I'm continuously receiving incorrect password errors despite resetting my password multiple times.,Pending,"['very', 'seat', 'such']",True,Email exchange with Joseph Martin on 2024-07-20
TICK8c5c9539,CUST0787ac4a,I'm experiencing performance issues where the application response time is significantly slower than expected during peak hours.,Pending,"['box', 'machine', 'standard']",False,Email exchange with Angela Hernandez on 2023-12-08
TICK728c1a0a,CUSTeafecae0,"I'm experiencing significant performance slowdowns in the CloudScape dashboard, causing delays when accessing analytics features.",Pending,"['pay', 'thing', 'suffer']",True,Email exchange with James Wood on 2024-02-10
TICK52c7a4da,CUST2b41cbfa,"I'm experiencing a technical issue with CloudScape Technologies where the SaaS platform intermittently logs me out during active sessions, disrupting my workflow.",Closed,"['law', 'so', 'sell']",False,Email exchange with Justin Smith on 2024-11-17
TICK83a17d8a,CUST0ee8cfb0,I am unable to access my account on the CloudScape platform due to continuous login failures despite entering correct credentials.,Open,"['well', 'consumer', 'always']",True,Email exchange with Alexandra Rowe on 2024-09-01
TICKd2f0c71e,CUSTea51dcff,I'm experiencing slow performance and frequent time-outs when trying to access the reporting dashboard on CloudScape Technologies' platform.,Resolved,"['mean', 'health', 'enough']",False,Email exchange with Brandon Andrews on 2024-05-16
TICK18c5f3d1,CUST3c21bccd,"I'm experiencing a technical issue where I am unable to log in to my account on the CloudScape platform, despite entering the correct credentials, and I suspect it might be related to the recent software update.",Resolved,"['drug', 'agent', 'page']",False,Email exchange with Holly Ortiz on 2024-09-23
TICKfe15943b,CUST492cc588,"I am experiencing intermittent login failures when trying to access our dashboard on CloudScape Technologies' platform, which disrupts our workflow management.",Resolved,"['sea', 'wish', 'spend']",True,Email exchange with Tyler King on 2024-10-31
TICKa5f6fc11,CUSTdecdf33b,"I am experiencing login issues with CloudScape Technologies' platform, where the system fails to authenticate my credentials despite them being correct.",Closed,"['night', 'particular', 'approach']",False,Email exchange with Russell Lopez on 2023-12-21
TICKb39bbb38,CUST57161006,I'm experiencing frequent login timeouts when attempting to access our project management dashboard on CloudScape Technologies' platform.,Closed,"['sign', 'decide', 'first']",False,Email exchange with Rodney Bowers on 2024-07-22
TICK04829bfb,CUSTdeeaf5fa,"My team is experiencing significant lag and slow response times when using the dashboard feature of CloudScape Technologies, affecting our workflow efficiency.",Pending,"['share', 'population', 'father']",False,Email exchange with Kevin Hansen on 2024-03-17
TICK8909f676,CUST2cc6a5a3,"I'm experiencing intermittent login issues where the system fails to authenticate, causing disruption to my access and workflow.",Closed,"['town', 'relate', 'someone']",False,Email exchange with Lisa Howard on 2024-04-21
TICKcc2662a7,CUST5ac52854,I am experiencing slow loading times and frequent timeouts when attempting to access my dashboard on the CloudScape Technologies platform.,Resolved,"['probably', 'first', 'there']",True,Email exchange with Jeremy Foster on 2024-02-18
TICKc564f6db,CUST681bcf06,"While trying to access the CloudScape portal, I frequently encounter performance issues where the dashboard takes an unusually long time to load, impacting my ability to manage services effectively.",Pending,"['build', 'than', 'significant']",True,Email exchange with Evan Green on 2024-01-06
TICK7782653f,CUSTd06d48c6,I'm experiencing prolonged load times and occasional timeouts when attempting to access CloudScape Technologies' reporting dashboard on my account.,Resolved,"['audience', 'question', 'let']",False,Email exchange with Gabriella Townsend on 2024-06-25
TICK50e062e9,CUSTd06d48c6,"I'm experiencing intermittent login issues where I'm frequently logged out of my account, and it affects my ability to use the service effectively.",Closed,"['task', 'even', 'look']",True,Email exchange with James Booth on 2024-10-10
TICKfb2f6138,CUST2cc6a5a3,"I'm experiencing intermittent login failures when trying to access the dashboard on CloudScape Technologies' platform, which is interrupting my workflow.",Open,"['director', 'nothing', 'enter']",True,Email exchange with Charles Rasmussen on 2024-09-06
TICK2e78e57d,CUST019d0272,"""I'm experiencing intermittent login failures with CloudScape's service portal, making it difficult to access necessary tools for our operations.""",Resolved,"['choice', 'idea', 'simple']",True,Email exchange with Kevin Riddle on 2024-02-09
TICK12c20527,CUST784c4b4c,"I'm experiencing intermittent login issues where I'm unable to access my account, despite entering the correct credentials, and this is affecting my ability to use the service smoothly.",Open,"['class', 'community', 'ground']",True,Email exchange with Robert Warner on 2024-05-09
TICK31efcad8,CUSTfd389ded,"I am experiencing intermittent login failures when trying to access our company's account on CloudScape Technologies' platform, which interrupts our workflow.",Closed,"['he', 'produce', 'health']",True,Email exchange with Holly Johnson on 2024-03-07
TICK9c0ca300,CUST34bd1056,I'm experiencing a login issue where the authentication system doesn't recognize my credentials despite them being entered correctly.,Resolved,"['network', 'give', 'house']",False,Email exchange with Thomas Stokes on 2024-01-19
TICK8b28e55f,CUST3e719c54,"I am having trouble logging into my CloudScape Technologies account as it repeatedly shows an 'Invalid credentials' error, despite using the correct username and password.",Resolved,"['recently', 'work', 'bring']",False,Email exchange with Anthony Price on 2024-07-10
TICK596ed298,CUSTcd621d3d,"I am experiencing frequent login failures with CloudScape Technologies' platform, where my credentials are not being recognized despite being entered correctly.",Closed,"['movement', 'two', 'sister']",False,Email exchange with Christina Smith on 2023-12-04
TICK7552c9fa,CUSTcd621d3d,"I am experiencing intermittent login issues where my credentials are sporadically unrecognized, preventing me from accessing CloudScape Technologies’ platform consistently.",Resolved,"['at', 'year', 'realize']",False,Email exchange with Crystal Mendez on 2024-05-11
TICK1265a094,CUST019d0272,"I'm experiencing frequent login timeouts with my CloudScape Technologies account, preventing stable access to the services.",Pending,"['street', 'back', 'small']",True,Email exchange with Dr. Kyle Mcgrath on 2024-01-07
TICK0d62d7f4,CUST0306895b,I'm experiencing a technical issue where our team is unable to access the dashboard due to a persistent login failure despite correct credentials being used.,Pending,"['nature', 'summer', 'vote']",False,Email exchange with Amy Thompson on 2024-11-25
TICK802b3b9f,CUST34bd1056,I'm experiencing frequent login issues where the system logs me out unexpectedly and does not recognize my credentials upon attempting to log back in.,Pending,"['later', 'least', 'oil']",False,Email exchange with Erica Gordon on 2024-08-24
TICKdbb238d6,CUST21f6ccb1,I am experiencing intermittent login failures when trying to access the CloudScape platform with my credentials.,Closed,"['that', 'see', 'kitchen']",False,Email exchange with Kenneth Price on 2024-05-26
TICK5c0aac78,CUSTb08e2abe,"""I'm experiencing frequent disconnects and latency issues when using the analytics dashboard in CloudScape Technologies' service, making it difficult to access and analyze real-time data effectively.""",Pending,"['issue', 'trip', 'option']",False,Email exchange with Dawn Finley on 2023-12-13
TICKd087734c,CUST76504b64,"As Randy Castillo from Avila-Khan, I'm experiencing sluggish performance when accessing CloudScape Technologies' dashboard, causing delays in loading data and affecting workflow efficiency.",Resolved,"['seven', 'lose', 'think']",False,Email exchange with Randy Castillo on 2024-07-30
TICK23793067,CUST19c28c20,I'm unable to access the analytics dashboard on CloudScape Technologies' platform due to persistent login issues.,Closed,"['guy', 'large', 'family']",True,Email exchange with Peter Collins on 2024-03-18
TICK130366ec,CUSTe6ffd849,"Subject: Performance Issue: Slow Loading Times for Dashboard

Issue Description:
I'm experiencing significant delays when trying to access and navigate the main dashboard on your platform. The loading times are unusually long, making it difficult to efficiently use the service for daily tasks.",Open,"['white', 'such', 'physical']",False,Email exchange with Katherine Taylor on 2024-02-11
TICK750cda9c,CUST2cb7425e,"I am experiencing a significant delay in the application's response time when attempting to load the dashboard, which is affecting my ability to access real-time data and insights effectively.",Resolved,"['chance', 'because', 'protect']",False,Email exchange with Alan Mitchell on 2024-07-07
TICK31664093,CUSTeb6f8e57,"I'm experiencing intermittent login issues where the authentication system fails, and I'm unable to access my dashboard on CloudScape Technologies' platform.",Resolved,"['hit', 'run', 'side']",True,Email exchange with Nicholas Kent on 2024-03-19
TICK1a102ee7,CUSTea2c8680,"As a customer using CloudScape Technologies' services, I'm experiencing intermittent login failures where I receive error messages despite entering the correct credentials.",Open,"['opportunity', 'reduce', 'style']",True,Email exchange with Robert Hughes on 2024-08-16
TICK92144df0,CUSTfdc330ea,"""I am experiencing frequent login timeouts when trying to access the CloudScape Technologies SaaS platform, causing interruptions in my work.""",Resolved,"['life', 'office', 'wide']",False,Email exchange with Miranda Reid on 2024-03-30
TICK89e8ac63,CUST2d64cf27,I am experiencing significant lag and delayed response times in the user interface while trying to access our company dashboard on the SaaS platform.,Closed,"['reason', 'would', 'another']",True,Email exchange with Christina Martinez on 2024-10-18
TICK3f086b74,CUSTfe544956,"The dashboard loads very slowly and sometimes fails to display data, which impacts my ability to efficiently monitor and manage our resources.",Open,"['debate', 'within', 'federal']",False,Email exchange with Kristy Stanley DVM on 2024-07-02
