ticket_id,customer_id,issue_summary,status,tags,kb_reference,email_conversations
TICKdb85fca7,CUSTb8962bb3,"I'm experiencing a technical issue where the application's login page is unresponsive and fails to load properly, preventing access to my account.",Resolved,"['professional', 'movement', 'issue']",False,Email exchange with Heather Sawyer on 2024-01-21
TICK9d9c5371,CUST7ec15dbc,I am experiencing intermittent login issues where I am frequently logged out of my CloudScape Technologies account without any notifications or apparent trigger.,Pending,"['discussion', 'light', 'sing']",True,Email exchange with Lisa Marsh on 2024-09-05
TICK2423adc5,CUST7216181b,"I'm experiencing a technical issue where I am unable to log into my CloudScape account, despite entering the correct credentials, due to a persistent error message indicating authentication failure.",Resolved,"['once', 'notice', 'along']",True,Email exchange with Kyle Sandoval on 2024-09-04
TICKff495b3a,CUST8c2f12a4,"As a customer at Chan, Moore and Crawford, I'm experiencing a technical issue where the SaaS platform from CloudScape Technologies is loading very slowly, impacting our team's productivity.",Open,"['line', 'financial', 'about']",True,Email exchange with Eric Thomas on 2023-12-16
TICKd77d4476,CUSTf5922c31,"I'm encountering a persistent login issue where the system fails to recognize valid credentials, preventing access to my account.",Closed,"['if', 'catch', 'although']",False,Email exchange with Debbie Mckinney on 2024-02-12
TICKbec0de52,CUST0c64ac3b,"I'm experiencing intermittent performance issues where the SaaS platform slows down drastically while attempting to upload files, affecting my workflow efficiency.",Closed,"['describe', 'evidence', 'around']",True,Email exchange with Rebecca Murray on 2024-06-16
TICK436c177f,CUSTdff261b6,"""I'm encountering a performance issue with the CloudScape dashboard, as it loads very slowly compared to usual.""",Closed,"['family', 'girl', 'day']",False,Email exchange with Christina White on 2024-06-12
TICK0a8e097d,CUST19c28c20,"I am experiencing intermittent login issues when trying to access the dashboard, where it often times out or fails to load completely.",Open,"['specific', 'interest', 'month']",False,Email exchange with Joy Doyle on 2024-04-15
TICK1512843b,CUST21f6ccb1,"Jennifer Rose experiences intermittent login issues with CloudScape Technologies' platform, often requiring multiple attempts to access her account.",Closed,"['require', 'board', 'hit']",False,Email exchange with Jennifer Rose on 2024-05-10
TICK64bddeca,CUSTa167c4b5,"I'm experiencing intermittent login issues with the CloudScape platform, where access is consistently denied despite correct credentials.",Resolved,"['other', 'clear', 'shake']",True,Email exchange with Jessica Parker on 2024-01-04
TICK77969c0a,CUST5d7ee20e,I'm experiencing excessively slow loading times and frequent timeouts when attempting to access the analytics dashboard on CloudScape Technologies' SaaS platform.,Closed,"['your', 'action', 'room']",False,Email exchange with Paul Parker on 2024-02-02
TICK5c03de76,CUSTb62bda90,"I'm experiencing intermittent login failures while trying to access our company's dashboard on CloudScape Technologies' platform, which affects my productivity and access to real-time data.",Resolved,"['generation', 'dinner', 'red']",True,Email exchange with Daniel Ray on 2023-12-16
TICK1b6f496b,CUST14cea97e,I'm experiencing significant delays in the application's response time when trying to access the analytics dashboard.,Pending,"['during', 'two', 'southern']",True,Email exchange with Amy Martinez on 2024-03-13
TICK49142e48,CUSTd225e373,"I am experiencing significant latency and frequent timeouts while trying to access our project management dashboard through CloudScape Technologies' platform, which is affecting our team's productivity.",Open,"['increase', 'two', 'song']",True,Email exchange with Laura Campbell on 2024-04-23
